[
  {
    "id": "EAU-0001",
    "title": "Pin Actions & publish SBOM on release",
    "created": "2025-10-31T00:31:29.0067583-04:00",
    "updated": "2025-10-31T00:31:29.0067583-04:00",
    "version": "0.1.0",
    "scope": {
      "repos": [
        "CoCache"
      ],
      "tags": []
    },
    "rationale": "Reduce supply-chain risk; increase release provenance.",
    "comparators": [],
    "proposed_actions": [],
    "copy_paste": {
      "pr_text_path": "70_TEMPLATES/PR_TEXT_TEMPLATE.md",
      "issue_text_path": "70_TEMPLATES/ISSUE_TEXT_TEMPLATE.md",
      "files_to_add": []
    },
    "evidence": [],
    "provenance": {
      "confidence": "medium",
      "sources": []
    },
    "freshness": {
      "expires_after_days": 120,
      "review_in_days": 30
    },
    "status": "draft"
  },
  {
    "id": "EAU-0002",
    "title": "Enforce branch protection + required checks (CI, CodeQL, Guard)",
    "created": "2025-10-31T00:34:17.3891129-04:00",
    "updated": "2025-10-31T00:34:17.3891129-04:00",
    "version": "0.1.0",
    "scope": {
      "tags": [],
      "repos": [
        "CoCache"
      ]
    },
    "rationale": "Raise minimum safety bar & reduce regressions.",
    "comparators": [],
    "proposed_actions": [],
    "copy_paste": {
      "files_to_add": [],
      "issue_text_path": "70_TEMPLATES/ISSUE_TEXT_TEMPLATE.md",
      "pr_text_path": "70_TEMPLATES/PR_TEXT_TEMPLATE.md"
    },
    "evidence": [],
    "provenance": {
      "confidence": "medium",
      "sources": []
    },
    "freshness": {
      "expires_after_days": 120,
      "review_in_days": 30
    },
    "status": "draft"
  },
  {
    "id": "EAU-0003",
    "title": "One-screen Quickstart + CODEOWNERS + Issue/PR templates",
    "created": "2025-10-31T00:34:18.0763922-04:00",
    "updated": "2025-10-31T00:34:18.0763922-04:00",
    "version": "0.1.0",
    "scope": {
      "tags": [],
      "repos": [
        "CoCache"
      ]
    },
    "rationale": "Lower time-to-first-success; increase PR throughput.",
    "comparators": [],
    "proposed_actions": [],
    "copy_paste": {
      "files_to_add": [],
      "pr_text_path": "70_TEMPLATES/PR_TEXT_TEMPLATE.md",
      "issue_text_path": "70_TEMPLATES/ISSUE_TEXT_TEMPLATE.md"
    },
    "evidence": [],
    "provenance": {
      "confidence": "medium",
      "sources": []
    },
    "freshness": {
      "expires_after_days": 120,
      "review_in_days": 30
    },
    "status": "draft"
  },
  {
    "id": "EAU-0004",
    "title": "Pin all GitHub Actions by SHA (not tags)",
    "created": "2025-10-31T00:38:26.8289189-04:00",
    "updated": "2025-10-31T00:38:26.8289189-04:00",
    "version": "0.1.0",
    "scope": {
      "repos": [
        "CoCache"
      ],
      "tags": []
    },
    "rationale": "Tags can move; SHA pinning reduces hijack risk.",
    "comparators": [],
    "proposed_actions": [],
    "copy_paste": {
      "files_to_add": [],
      "issue_text_path": "70_TEMPLATES/ISSUE_TEXT_TEMPLATE.md",
      "pr_text_path": "70_TEMPLATES/PR_TEXT_TEMPLATE.md"
    },
    "evidence": [],
    "provenance": {
      "confidence": "medium",
      "sources": []
    },
    "freshness": {
      "review_in_days": 30,
      "expires_after_days": 120
    },
    "status": "draft"
  },
  {
    "id": "EAU-0005",
    "title": "Unified Issue/PR templates + triage labels (policy, trust-pack, first-build)",
    "created": "2025-10-31T00:38:27.5688763-04:00",
    "updated": "2025-10-31T00:38:27.5688763-04:00",
    "version": "0.1.0",
    "scope": {
      "tags": [],
      "repos": [
        "CoCache"
      ]
    },
    "rationale": "Reduce PR review time; improve routing and visibility.",
    "comparators": [],
    "proposed_actions": [],
    "copy_paste": {
      "pr_text_path": "70_TEMPLATES/PR_TEXT_TEMPLATE.md",
      "issue_text_path": "70_TEMPLATES/ISSUE_TEXT_TEMPLATE.md",
      "files_to_add": []
    },
    "evidence": [],
    "provenance": {
      "sources": [],
      "confidence": "medium"
    },
    "freshness": {
      "review_in_days": 30,
      "expires_after_days": 120
    },
    "status": "draft"
  }
]
