{
  "id": "EAU-0002",
  "title": "Enforce branch protection + required checks (CI, CodeQL, Guard)",
  "created": "2025-10-31T00:34:17.3891129-04:00",
  "updated": "2025-10-31T00:34:17.3891129-04:00",
  "version": "0.1.0",
  "scope": {
    "tags": [],
    "repos": [
      "CoCache"
    ]
  },
  "rationale": "Raise minimum safety bar & reduce regressions.",
  "comparators": [],
  "proposed_actions": [],
  "copy_paste": {
    "files_to_add": [],
    "issue_text_path": "70_TEMPLATES/ISSUE_TEXT_TEMPLATE.md",
    "pr_text_path": "70_TEMPLATES/PR_TEXT_TEMPLATE.md"
  },
  "evidence": [],
  "provenance": {
    "confidence": "medium",
    "sources": []
  },
  "freshness": {
    "expires_after_days": 120,
    "review_in_days": 30
  },
  "status": "draft"
}
