{
  "id": "EAU-0005",
  "title": "Unified Issue/PR templates + triage labels (policy, trust-pack, first-build)",
  "created": "2025-10-31T00:38:27.5688763-04:00",
  "updated": "2025-10-31T00:38:27.5688763-04:00",
  "version": "0.1.0",
  "scope": {
    "tags": [],
    "repos": [
      "CoCache"
    ]
  },
  "rationale": "Reduce PR review time; improve routing and visibility.",
  "comparators": [],
  "proposed_actions": [],
  "copy_paste": {
    "pr_text_path": "70_TEMPLATES/PR_TEXT_TEMPLATE.md",
    "issue_text_path": "70_TEMPLATES/ISSUE_TEXT_TEMPLATE.md",
    "files_to_add": []
  },
  "evidence": [],
  "provenance": {
    "sources": [],
    "confidence": "medium"
  },
  "freshness": {
    "review_in_days": 30,
    "expires_after_days": 120
  },
  "status": "draft"
}
